{
  "id": "kit-planner-rotina-tea-05-minha-rotina-semanal",
  "titulo": "Minha Rotina Semanal",
  "subtitulo": null,
  "categoria": [
    "Rotinas"
  ],
  "tags": [],
  "faixaEtaria": null,
  "arquivoVisual": "/recursos/produto-principal/05-minha-rotina-semanal.png",
  "arquivoImpressao": "/imprimiveis/Kit-Planner-Rotina-TEA.pdf",
  "produtoOrigem": "Kit Planner Rotina TEA",
  "descricaoAprovada": null,
  "situacoesDeUso": [],
  "instrucoesDeUso": [],
  "camposParaObservar": [],
  "informacoesParaCompartilhar": [],
  "aviso": null,
  "fonteDoConteudo": "imagem-final:produto-principal/05-minha-rotina-semanal.png",
  "fontesPorCampo": {
    "titulo": "imagem-final:produto-principal/05-minha-rotina-semanal.png",
    "categoria": "imagem-final:produto-principal/05-minha-rotina-semanal.png",
    "produtoOrigem": "imagem-final:produto-principal/05-minha-rotina-semanal.png"
  }
}
