{
  "id": "kit-planner-rotina-tea-12-minha-mochila",
  "titulo": "Checklist da Mochila",
  "subtitulo": null,
  "categoria": [
    "Rotinas",
    "Escola"
  ],
  "tags": [],
  "faixaEtaria": null,
  "arquivoVisual": "/recursos/produto-principal/12-minha-mochila.png",
  "arquivoImpressao": "/imprimiveis/Kit-Planner-Rotina-TEA.pdf",
  "produtoOrigem": "Kit Planner Rotina TEA",
  "descricaoAprovada": null,
  "situacoesDeUso": [],
  "instrucoesDeUso": [],
  "camposParaObservar": [],
  "informacoesParaCompartilhar": [],
  "aviso": null,
  "fonteDoConteudo": "imagem-final:produto-principal/12-minha-mochila.png",
  "fontesPorCampo": {
    "titulo": "imagem-final:produto-principal/12-minha-mochila.png",
    "categoria": "imagem-final:produto-principal/12-minha-mochila.png",
    "produtoOrigem": "imagem-final:produto-principal/12-minha-mochila.png"
  }
}
