{
  "id": "bonus-3-quadro-primeiro-depois-01-capa",
  "titulo": "Quadro Primeiro → Depois",
  "subtitulo": null,
  "categoria": [
    "Primeiro e Depois"
  ],
  "tags": [],
  "faixaEtaria": null,
  "arquivoVisual": "/recursos/bonus-03-primeiro-depois/01-capa.png",
  "arquivoImpressao": "/imprimiveis/Bonus-03-Quadro-Primeiro-Depois.pdf",
  "produtoOrigem": "Bônus 3 — Quadro Primeiro → Depois",
  "descricaoAprovada": null,
  "situacoesDeUso": [],
  "instrucoesDeUso": [],
  "camposParaObservar": [],
  "informacoesParaCompartilhar": [],
  "aviso": null,
  "fonteDoConteudo": "imagem-final:bonus-03-primeiro-depois/01-capa.png",
  "fontesPorCampo": {
    "titulo": "imagem-final:bonus-03-primeiro-depois/01-capa.png",
    "categoria": "imagem-final:bonus-03-primeiro-depois/01-capa.png",
    "produtoOrigem": "imagem-final:bonus-03-primeiro-depois/01-capa.png"
  }
}
