{
  "id": "kit-planner-rotina-tea-22-certificado-conquista-da-rotina",
  "titulo": "Conquista da Rotina",
  "subtitulo": null,
  "categoria": [
    "Rotinas",
    "Missões e Recompensas"
  ],
  "tags": [],
  "faixaEtaria": null,
  "arquivoVisual": "/recursos/produto-principal/22-certificado-conquista-da-rotina.png",
  "arquivoImpressao": "/imprimiveis/Kit-Planner-Rotina-TEA.pdf",
  "produtoOrigem": "Kit Planner Rotina TEA",
  "descricaoAprovada": null,
  "situacoesDeUso": [],
  "instrucoesDeUso": [],
  "camposParaObservar": [],
  "informacoesParaCompartilhar": [],
  "aviso": null,
  "fonteDoConteudo": "imagem-final:produto-principal/22-certificado-conquista-da-rotina.png",
  "fontesPorCampo": {
    "titulo": "imagem-final:produto-principal/22-certificado-conquista-da-rotina.png",
    "categoria": "imagem-final:produto-principal/22-certificado-conquista-da-rotina.png",
    "produtoOrigem": "imagem-final:produto-principal/22-certificado-conquista-da-rotina.png"
  }
}
