{
  "id": "kit-planner-rotina-tea-17-calendario-mensal",
  "titulo": "Meu Calendário Mensal",
  "subtitulo": null,
  "categoria": [
    "Rotinas",
    "Calendário Visual"
  ],
  "tags": [],
  "faixaEtaria": null,
  "arquivoVisual": "/recursos/produto-principal/17-calendario-mensal.png",
  "arquivoImpressao": "/imprimiveis/Kit-Planner-Rotina-TEA.pdf",
  "produtoOrigem": "Kit Planner Rotina TEA",
  "descricaoAprovada": null,
  "situacoesDeUso": [],
  "instrucoesDeUso": [],
  "camposParaObservar": [],
  "informacoesParaCompartilhar": [],
  "aviso": null,
  "fonteDoConteudo": "imagem-final:produto-principal/17-calendario-mensal.png",
  "fontesPorCampo": {
    "titulo": "imagem-final:produto-principal/17-calendario-mensal.png",
    "categoria": "imagem-final:produto-principal/17-calendario-mensal.png",
    "produtoOrigem": "imagem-final:produto-principal/17-calendario-mensal.png"
  }
}
