{
  "id": "bonus-5-calendario-visual-03-calendario-mensal",
  "titulo": "Calendário Mensal",
  "subtitulo": null,
  "categoria": [
    "Calendário Visual"
  ],
  "tags": [],
  "faixaEtaria": null,
  "arquivoVisual": "/recursos/bonus-05-calendario-visual/03-calendario-mensal.png",
  "arquivoImpressao": "/imprimiveis/Bonus-05-Calendario-Visual.pdf",
  "produtoOrigem": "Bônus 5 — Calendário Visual",
  "descricaoAprovada": null,
  "situacoesDeUso": [],
  "instrucoesDeUso": [],
  "camposParaObservar": [],
  "informacoesParaCompartilhar": [],
  "aviso": null,
  "fonteDoConteudo": "imagem-final:bonus-05-calendario-visual/03-calendario-mensal.png",
  "fontesPorCampo": {
    "titulo": "imagem-final:bonus-05-calendario-visual/03-calendario-mensal.png",
    "categoria": "imagem-final:bonus-05-calendario-visual/03-calendario-mensal.png",
    "produtoOrigem": "imagem-final:bonus-05-calendario-visual/03-calendario-mensal.png"
  }
}
