{
  "id": "bonus-4-rotina-por-ambientes-01-capa",
  "titulo": "Rotina por Ambientes",
  "subtitulo": null,
  "categoria": [
    "Rotinas por Ambiente"
  ],
  "tags": [],
  "faixaEtaria": null,
  "arquivoVisual": "/recursos/bonus-04-rotina-ambientes/01-capa.png",
  "arquivoImpressao": "/imprimiveis/Bonus-04-Rotina-por-Ambientes.pdf",
  "produtoOrigem": "Bônus 4 — Rotina por Ambientes",
  "descricaoAprovada": null,
  "situacoesDeUso": [],
  "instrucoesDeUso": [],
  "camposParaObservar": [],
  "informacoesParaCompartilhar": [],
  "aviso": null,
  "fonteDoConteudo": "imagem-final:bonus-04-rotina-ambientes/01-capa.png",
  "fontesPorCampo": {
    "titulo": "imagem-final:bonus-04-rotina-ambientes/01-capa.png",
    "categoria": "imagem-final:bonus-04-rotina-ambientes/01-capa.png",
    "produtoOrigem": "imagem-final:bonus-04-rotina-ambientes/01-capa.png"
  }
}
