{
  "id": "material-adicional-criado-caderno-das-emocoes-tea-08-meu-plano-de-calma",
  "titulo": "Meu Plano De Calma",
  "subtitulo": null,
  "categoria": [
    "Emoções e Autorregulação"
  ],
  "tags": [],
  "faixaEtaria": null,
  "arquivoVisual": "/recursos/bonus-01-caderno-emocoes/08-meu-plano-de-calma.png",
  "arquivoImpressao": "/imprimiveis/Bonus-01-Caderno-das-Emocoes-TEA.pdf",
  "produtoOrigem": "Material adicional criado — Caderno das Emoções TEA",
  "descricaoAprovada": null,
  "situacoesDeUso": [],
  "instrucoesDeUso": [],
  "camposParaObservar": [],
  "informacoesParaCompartilhar": [],
  "aviso": null,
  "fonteDoConteudo": "imagem-final:bonus-01-caderno-emocoes/08-meu-plano-de-calma.png",
  "fontesPorCampo": {
    "titulo": "imagem-final:bonus-01-caderno-emocoes/08-meu-plano-de-calma.png",
    "categoria": "imagem-final:bonus-01-caderno-emocoes/08-meu-plano-de-calma.png",
    "produtoOrigem": "imagem-final:bonus-01-caderno-emocoes/08-meu-plano-de-calma.png"
  }
}
