{
  "id": "bonus-1-guia-dos-pais-11-quando-nao-funcionar",
  "titulo": "Quando Nao Funcionar",
  "subtitulo": null,
  "categoria": [
    "Guia dos Pais"
  ],
  "tags": [],
  "faixaEtaria": null,
  "arquivoVisual": "/recursos/bonus-01-guia-dos-pais/11-quando-nao-funcionar.png",
  "arquivoImpressao": "/imprimiveis/Bonus-01-Guia-dos-Pais.pdf",
  "produtoOrigem": "Bônus 1 — Guia dos Pais",
  "descricaoAprovada": null,
  "situacoesDeUso": [],
  "instrucoesDeUso": [],
  "camposParaObservar": [],
  "informacoesParaCompartilhar": [],
  "aviso": null,
  "fonteDoConteudo": "imagem-final:bonus-01-guia-dos-pais/11-quando-nao-funcionar.png",
  "fontesPorCampo": {
    "titulo": "imagem-final:bonus-01-guia-dos-pais/11-quando-nao-funcionar.png",
    "categoria": "imagem-final:bonus-01-guia-dos-pais/11-quando-nao-funcionar.png",
    "produtoOrigem": "imagem-final:bonus-01-guia-dos-pais/11-quando-nao-funcionar.png"
  }
}
