{
  "id": "kit-planner-rotina-tea-15-planejamento-de-provas",
  "titulo": "Planejamento de Provas",
  "subtitulo": null,
  "categoria": [
    "Rotinas",
    "Escola"
  ],
  "tags": [],
  "faixaEtaria": null,
  "arquivoVisual": "/recursos/produto-principal/15-planejamento-de-provas.png",
  "arquivoImpressao": "/imprimiveis/Kit-Planner-Rotina-TEA.pdf",
  "produtoOrigem": "Kit Planner Rotina TEA",
  "descricaoAprovada": null,
  "situacoesDeUso": [],
  "instrucoesDeUso": [],
  "camposParaObservar": [],
  "informacoesParaCompartilhar": [],
  "aviso": null,
  "fonteDoConteudo": "imagem-final:produto-principal/15-planejamento-de-provas.png",
  "fontesPorCampo": {
    "titulo": "imagem-final:produto-principal/15-planejamento-de-provas.png",
    "categoria": "imagem-final:produto-principal/15-planejamento-de-provas.png",
    "produtoOrigem": "imagem-final:produto-principal/15-planejamento-de-provas.png"
  }
}
