{
  "id": "bonus-1-guia-dos-pais-06-dia-2-apresente-os-cartoes",
  "titulo": "Dia 2 Apresente Os Cartões",
  "subtitulo": null,
  "categoria": [
    "Guia dos Pais",
    "Comunicação Visual"
  ],
  "tags": [],
  "faixaEtaria": null,
  "arquivoVisual": "/recursos/bonus-01-guia-dos-pais/06-dia-2-apresente-os-cartoes.png",
  "arquivoImpressao": "/imprimiveis/Bonus-01-Guia-dos-Pais.pdf",
  "produtoOrigem": "Bônus 1 — Guia dos Pais",
  "descricaoAprovada": null,
  "situacoesDeUso": [],
  "instrucoesDeUso": [],
  "camposParaObservar": [],
  "informacoesParaCompartilhar": [],
  "aviso": null,
  "fonteDoConteudo": "imagem-final:bonus-01-guia-dos-pais/06-dia-2-apresente-os-cartoes.png",
  "fontesPorCampo": {
    "titulo": "imagem-final:bonus-01-guia-dos-pais/06-dia-2-apresente-os-cartoes.png",
    "categoria": "imagem-final:bonus-01-guia-dos-pais/06-dia-2-apresente-os-cartoes.png",
    "produtoOrigem": "imagem-final:bonus-01-guia-dos-pais/06-dia-2-apresente-os-cartoes.png"
  }
}
